utterance,intent,entity_type,entity_value,start_offset,end_offset,category,tags
I don't know how I could order a few of your product,place_order,,,,,ORDER,BLMP
where to acquire several of ur item,place_order,,,,,ORDER,BILMQ
need assistance purchasing an item,place_order,,,,,ORDER,BLQ
help me purchasing some of your article,place_order,,,,,ORDER,BLM
I'd like to earn several items will ya help me,place_order,,,,,ORDER,BCILMPQ
can ya help me acquire several items,place_order,,,,,ORDER,BILMQ
i need assistance buying some products,place_order,,,,,ORDER,BLMQ
can you help me ordering a few of your product?,place_order,,,,,ORDER,BILM
i need help to shop some of ur product,place_order,,,,,ORDER,BLMQ
I want to earn a few of your article,place_order,,,,,ORDER,BLM
I do not know what I have to do to acquire some items,place_order,,,,,ORDER,BELM
help me earn a product,place_order,,,,,ORDER,BL
i do not know how i can order a goddamn atticle,place_order,,,,,ORDER,BELQWZ
making purchase,place_order,,,,,ORDER,BK
need help to order  a few of ur article,place_order,,,,,ORDER,BLMQZ
need help purchasing a few  of your product,place_order,,,,,ORDER,BLMQZ
want help buying an item,place_order,,,,,ORDER,BQ
I do not know what I have to do to order a product,place_order,,,,,ORDER,BEL
need help shopping a few of ur prodxuct,place_order,,,,,ORDER,BLMQZ
can you help me shop something?,place_order,,,,,ORDER,BIL
where to earn some of your product?,place_order,,,,,ORDER,BILM
"I want to earn several articles, how could I do it?",place_order,,,,,ORDER,BCILMP
i dont know how i can earn several of ur item,place_order,,,,,ORDER,BLMQ
assistance to order an item,place_order,,,,,ORDER,BL
I need assistance to purchase a product,place_order,,,,,ORDER,BL
I don't know what I have to do to purchase some damn items,place_order,,,,,ORDER,BLMW
I have to acquire several prodcuts,place_order,,,,,ORDER,BLMZ
"I have got to earn some products, how do I do it?",place_order,,,,,ORDER,BCILM
i want assistnce shopping an item,place_order,,,,,ORDER,BLQZ
I do not know what to do to earn some items,place_order,,,,,ORDER,BELM
I don't know how to acquire something,place_order,,,,,ORDER,BL
"I want to earn several products, how can I do it ?",place_order,,,,,ORDER,BCILMZ
is it possible to order an item?,place_order,,,,,ORDER,BIL
want help ti earn some of ur product,place_order,,,,,ORDER,BLMQZ
i have to earn several of ur item help me,place_order,,,,,ORDER,BCLMQ
I need help to restore my profile password,recover_password,,,,,ACCOUNT,BL
i dont know what to  do to recover my account pin code,recover_password,,,,,ACCOUNT,BLQZ
I try to recover the PIN of my profile,recover_password,,,,,ACCOUNT,BL
i cant recover the access key of my user profile,recover_password,,,,,ACCOUNT,BLNQ
I can't recover the PIN of my account,recover_password,,,,,ACCOUNT,BLN
can you give me information about my forgotten PIN?,recover_password,,,,,ACCOUNT,BIL
i do not know how i can retrieve the pwd of my user,recover_password,,,,,ACCOUNT,BELQ
I cannot retrieve the goddamn password of my user,recover_password,,,,,ACCOUNT,BELNW
password recovery,recover_password,,,,,ACCOUNT,BK
i cannot remember my profile pin code how acn i reset it,recover_password,,,,,ACCOUNT,BCEILQZ
i want  help to reset my profile key,recover_password,,,,,ACCOUNT,BLQZ
problems with forgotten PIN,recover_password,,,,,ACCOUNT,BLM
I have problems with my key reset,recover_password,,,,,ACCOUNT,BLM
I want toreset the key of my user,recover_password,,,,,ACCOUNT,BLZ
can uhelp me retrieve my user account pin,recover_password,,,,,ACCOUNT,BILQ
I want assistance recovering the key of my user account,recover_password,,,,,ACCOUNT,BL
I do not know how I can retrieve my user profle pass,recover_password,,,,,ACCOUNT,BELQZ
wannarestore my profile access key,recover_password,,,,,ACCOUNT,BLQZ
can you help me restore the pass of my profile ?,recover_password,,,,,ACCOUNT,BILQZ
i have a question about my password reteieval,recover_password,,,,,ACCOUNT,BLQZ
i dont know what i have to do to recover my access key,recover_password,,,,,ACCOUNT,BLQ
is it possible to recover my user pin,recover_password,,,,,ACCOUNT,BILQ
question about  forgotten pass,recover_password,,,,,ACCOUNT,BLQZ
where do I restore the key of my profile?,recover_password,,,,,ACCOUNT,BIL
"I need to restore my profile PIN, could I get some help?",recover_password,,,,,ACCOUNT,BCILP
i lost my account password i have to restire it,recover_password,,,,,ACCOUNT,BCLQZ
I need to recover my account pwd,recover_password,,,,,ACCOUNT,BLQ
how can i recover my user pwd,recover_password,,,,,ACCOUNT,BILQ
I want information about forgotten PIN code,recover_password,,,,,ACCOUNT,BL
I don't know how to recover the password of my account,recover_password,,,,,ACCOUNT,BL
I want to restore the PIN code of my user,recover_password,,,,,ACCOUNT,BL
what do I need to do to recover the pass of my user profile?,recover_password,,,,,ACCOUNT,BILQ
I have got to reset the password of my user account,recover_password,,,,,ACCOUNT,BL
I want help recovering my user profile key,recover_password,,,,,ACCOUNT,BL
can you help me to retrieve the access key of my profile?,recover_password,,,,,ACCOUNT,BIL
I want to reset the PIN code of my profile,recover_password,,,,,ACCOUNT,BL
is it possible to retrieve my account pass?,recover_password,,,,,ACCOUNT,BILQ
I need help to retrieve the access key of my profile,recover_password,,,,,ACCOUNT,BL
where to restore my user profile pass,recover_password,,,,,ACCOUNT,BILQ
i do not know what to do to restore my account key,recover_password,,,,,ACCOUNT,BELQ
assistance restoring my user profile PIN,recover_password,,,,,ACCOUNT,BL
"someone has stolen my profile password, I have to restore it",recover_password,,,,,ACCOUNT,BCL
I want to retrieve the PIN code of my user profile,recover_password,,,,,ACCOUNT,BL
would you give me information about a PIN code reset?,recover_password,,,,,ACCOUNT,BILP
need help resetting my user profile PIN code,recover_password,,,,,ACCOUNT,BLQ
I have a problem with my PIN retrieval,recover_password,,,,,ACCOUNT,BL
I have got to reset the key of my user profile,recover_password,,,,,ACCOUNT,BL
I'm trying to find information about an lost pin,recover_password,,,,,ACCOUNT,BELQZ
where do I recover the pass of my user account?,recover_password,,,,,ACCOUNT,BILQ
how can I find information about a key recovery?,recover_password,,,,,ACCOUNT,BIL
have a question about the key retrieval,recover_password,,,,,ACCOUNT,BLQ
I want help to restore my password,recover_password,,,,,ACCOUNT,BL
could uhelp me restoring my  key,recover_password,,,,,ACCOUNT,BILPQZ
I have a problem with my lost access key,recover_password,,,,,ACCOUNT,BL
I need assistance to retrieve my user profile PIN code,recover_password,,,,,ACCOUNT,BL
help me to retrieve my account access key,recover_password,,,,,ACCOUNT,BL
could I recover my user password?,recover_password,,,,,ACCOUNT,BILP
reset the key of my user accounr,recover_password,,,,,ACCOUNT,BLZ
i forgot the key of my user help to reset it,recover_password,,,,,ACCOUNT,BCLQ
can you give me information about my PIN code reset?,recover_password,,,,,ACCOUNT,BIL
help to retrieve my PIN code,recover_password,,,,,ACCOUNT,BL
wanna recover my pwd,recover_password,,,,,ACCOUNT,BLQ
i forgot the pass of my user i have to resety it,recover_password,,,,,ACCOUNT,BCLQZ
help to recover my user profile PIN code,recover_password,,,,,ACCOUNT,BL
how do I restore my account pwd?,recover_password,,,,,ACCOUNT,BILQ
want assistance to restore my user account pssword,recover_password,,,,,ACCOUNT,BLQZ
i have lost my accont pin i have got to recover it,recover_password,,,,,ACCOUNT,BCLQZ
help restoring my rpofile key,recover_password,,,,,ACCOUNT,BLZ
how do i retrieve my user profioe key,recover_password,,,,,ACCOUNT,BILQZ
I want assistance resetting my user profile password,recover_password,,,,,ACCOUNT,BL
need help to reset the pin code of my account,recover_password,,,,,ACCOUNT,BLQ
i lost the pwd of my userr profile assistance to recover it,recover_password,,,,,ACCOUNT,BCLQZ
I am trying to retrieve my goddamn password,recover_password,,,,,ACCOUNT,BLW
I do not know how to reset the key of my user,recover_password,,,,,ACCOUNT,BEL
recover my user account access key,recover_password,,,,,ACCOUNT,BL
I need assistance to retrieve my PIN code,recover_password,,,,,ACCOUNT,BL
i lost the goddamn pwd of my account need help to restore it,recover_password,,,,,ACCOUNT,BCLQW
problem with my access key reset,recover_password,,,,,ACCOUNT,BL
i do not know how i can retrieve the password of my account,recover_password,,,,,ACCOUNT,BELQ
information about my PIN code recovery,recover_password,,,,,ACCOUNT,BL
I cannot recover my user password,recover_password,,,,,ACCOUNT,BELN
i need help recovering my user profile access key,recover_password,,,,,ACCOUNT,BLQ
I want to reset the access key of my account,recover_password,,,,,ACCOUNT,BL
can you help me restore my account pwd?,recover_password,,,,,ACCOUNT,BILQ
what do I need to do to restore my profile PIN code?,recover_password,,,,,ACCOUNT,BIL
I want to recover the pwd of my profile,recover_password,,,,,ACCOUNT,BLQ
"I forgot my user account PIN, I want help recovering it",recover_password,,,,,ACCOUNT,BCL
I need assistance to retrieve the key of my user account,recover_password,,,,,ACCOUNT,BL
how to reset the PIN code of my user profile ?,recover_password,,,,,ACCOUNT,BILZ
how can i get information about lost key,recover_password,,,,,ACCOUNT,BILMQ
want help retrieving my user account pin,recover_password,,,,,ACCOUNT,BLQ
i cannot rememberr my profile pin i want help recovering it,recover_password,,,,,ACCOUNT,BCELQZ
key of user profile,recover_password,,,,,ACCOUNT,BL
i do not know what to do to restore my user account pass,recover_password,,,,,ACCOUNT,BELQ
needhelp to retrieve my profile pass,recover_password,,,,,ACCOUNT,BLQZ
I need assistance recovering my account PIN,recover_password,,,,,ACCOUNT,BL
how to restore the password of my profile,recover_password,,,,,ACCOUNT,BILQ
I don't know what I need to do to restore my key,recover_password,,,,,ACCOUNT,BL
need to retrieve my user account pin code,recover_password,,,,,ACCOUNT,BLQ
how to restore my user profile password?,recover_password,,,,,ACCOUNT,BIL
how to restore my user PIN?,recover_password,,,,,ACCOUNT,BIL
I cannot reset myaccount PIN code,recover_password,,,,,ACCOUNT,BELNZ
can ugive me information about the password recovery,recover_password,,,,,ACCOUNT,BILQ
"I forgot my account password, could you help me restore it?",recover_password,,,,,ACCOUNT,BCILP
help to restore my key,recover_password,,,,,ACCOUNT,BL
where to restore my user account password?,recover_password,,,,,ACCOUNT,BIL
someone stolpe the key of my profile how do i retrieve it,recover_password,,,,,ACCOUNT,BCILQZ
I need help to recover my user key,recover_password,,,,,ACCOUNT,BL
I have to retrieve my profile PIN,recover_password,,,,,ACCOUNT,BL
how can I retrieve the PIN of my account?,recover_password,,,,,ACCOUNT,BIL
I have to reset my user profile key,recover_password,,,,,ACCOUNT,BL
i want help to restore the key of my user profile,recover_password,,,,,ACCOUNT,BLQ
I try to retrieve the access key of my user,recover_password,,,,,ACCOUNT,BL
"I have forgotten my profile key, could I reset it?",recover_password,,,,,ACCOUNT,BCILP
I don't know what to do to restore my profile access key,recover_password,,,,,ACCOUNT,BL
where to restore the pass of my user profile,recover_password,,,,,ACCOUNT,BILQ
where to restore the PIN code of my account?,recover_password,,,,,ACCOUNT,BIL
want help recovering the key of m profile,recover_password,,,,,ACCOUNT,BLQZ
problem with my forgotten password,recover_password,,,,,ACCOUNT,BL
i dont know what to do to retrieve my profile pin,recover_password,,,,,ACCOUNT,BLQ
help me retrieving my profile PIN,recover_password,,,,,ACCOUNT,BL
I don't know what to do to recover my user key,recover_password,,,,,ACCOUNT,BL
"I have forgotten my profile PIN, assistance recovering it",recover_password,,,,,ACCOUNT,BCL
how can I recover my user profile password?,recover_password,,,,,ACCOUNT,BIL
I am trying to recover my user account PIN,recover_password,,,,,ACCOUNT,BL
help to recover the access key of my user account,recover_password,,,,,ACCOUNT,BL
I try to reset the access key of my account,recover_password,,,,,ACCOUNT,BL
"I forgot the PIN of my user account, help recovering it",recover_password,,,,,ACCOUNT,BCL
assistance recovering the access key of my user,recover_password,,,,,ACCOUNT,BL
I don't know how I can restore the PIN of my user account,recover_password,,,,,ACCOUNT,BL
I want help to recover my user account password,recover_password,,,,,ACCOUNT,BL
information about my pwd reset,recover_password,,,,,ACCOUNT,BLQ
wannarestore my pin,recover_password,,,,,ACCOUNT,BLQZ
assistance to restore the password of my user profile,recover_password,,,,,ACCOUNT,BL
I don't know what to do to reset my user account PIN code,recover_password,,,,,ACCOUNT,BL
problem with lost PIN code,recover_password,,,,,ACCOUNT,BL
i want assistance resetting my profile pass,recover_password,,,,,ACCOUNT,BLQ
I have got to retrieve my user PIN code,recover_password,,,,,ACCOUNT,BL
I have to retrieve the pazssword of my user,recover_password,,,,,ACCOUNT,BLZ
want assistance to recover the PIN code of my user,recover_password,,,,,ACCOUNT,BLQ
assistance to reset the password of my profile,recover_password,,,,,ACCOUNT,BL
i need information about my lost password,recover_password,,,,,ACCOUNT,BLQ
assistance retrieving my profile pass,recover_password,,,,,ACCOUNT,BLQ
where could I retrieve the key of my account?,recover_password,,,,,ACCOUNT,BILP
help to restore the key of my user,recover_password,,,,,ACCOUNT,BL
i dont know how to restore the password of myprofile,recover_password,,,,,ACCOUNT,BLQZ
find information about the lost PIN code,recover_password,,,,,ACCOUNT,BL
can you help me recover the pass of my user?,recover_password,,,,,ACCOUNT,BILQ
"I want to reset my damn user account access key, help me",recover_password,,,,,ACCOUNT,BCLW
i do not know what to do to reset the pwd of my user profile,recover_password,,,,,ACCOUNT,BELQ
how to retrieve my account pwd?,recover_password,,,,,ACCOUNT,BILQ
i want help to reset my account pwd,recover_password,,,,,ACCOUNT,BLQ
help me retrieving my user profikle password,recover_password,,,,,ACCOUNT,BLZ
I have to retrieve the access key of my user account,recover_password,,,,,ACCOUNT,BL
help me retrieve my account access key,recover_password,,,,,ACCOUNT,BL
where to retrieve the pass of my account?,recover_password,,,,,ACCOUNT,BILQ
find information about forgotten pin code,recover_password,,,,,ACCOUNT,BLQ
i do not know how to reset the password of my profile,recover_password,,,,,ACCOUNT,BELQ
how can I restore the password of my user?,recover_password,,,,,ACCOUNT,BIL
how to retrieve my profile password?,recover_password,,,,,ACCOUNT,BIL
i do not know how to retrieve my user access key,recover_password,,,,,ACCOUNT,BELQ
"I want to restore my user password, I need assistance",recover_password,,,,,ACCOUNT,BCL
"I would like to recover my fucking password, how do I do it?",recover_password,,,,,ACCOUNT,BCIPW
I need help restoring the pwd of my accolunt,recover_password,,,,,ACCOUNT,BLQZ
where could i restore the password of my account,recover_password,,,,,ACCOUNT,BILPQ
I don't know how I can recover my password,recover_password,,,,,ACCOUNT,B
I have to restore the access key of my account,recover_password,,,,,ACCOUNT,BL
what do I have to do to restore my user profile key?,recover_password,,,,,ACCOUNT,BIL
have a question about the lost PIN code,recover_password,,,,,ACCOUNT,BLQ
I am trying to recover my user account access key,recover_password,,,,,ACCOUNT,BL
I need to reset the pass of my profile,recover_password,,,,,ACCOUNT,BLQ
i want assistance resetting my user account access key,recover_password,,,,,ACCOUNT,BLQ
i cant restore my user key,recover_password,,,,,ACCOUNT,BLNQ
can you help me reset my  user access key?,recover_password,,,,,ACCOUNT,BILZ
have problems with my access key recovery,recover_password,,,,,ACCOUNT,BLMQ
I don't know what to do to retrieve the PIN of my profile,recover_password,,,,,ACCOUNT,BL
"I need to restore my profile key, how to do it?",recover_password,,,,,ACCOUNT,BCIL
I can't reset the access key of my user profile,recover_password,,,,,ACCOUNT,BLN
help retrieving the password of my user account,recover_password,,,,,ACCOUNT,BL
what do I need to do to recover my user account key?,recover_password,,,,,ACCOUNT,BIL
I am trying to recover the PIN of my user profile,recover_password,,,,,ACCOUNT,BL
"I lost the password of my user, could I restore it?",recover_password,,,,,ACCOUNT,BCILP
want help recovering my account pwd,recover_password,,,,,ACCOUNT,BLQ
i dotn know how to retrieve the pass of my user,recover_password,,,,,ACCOUNT,BLQZ
help resetting the pwd of my user probile,recover_password,,,,,ACCOUNT,BLQZ
can uhelp me to retrieve my user pwd,recover_password,,,,,ACCOUNT,BILQ
where can Irestore the bloody key of my user?,recover_password,,,,,ACCOUNT,BILWZ
I have to restore the PIN code of my user profile,recover_password,,,,,ACCOUNT,BL
I need assistance recovdring my user password,recover_password,,,,,ACCOUNT,BLZ
need to reset my account password,recover_password,,,,,ACCOUNT,BLQ
could ya help me to reset my goddamn password,recover_password,,,,,ACCOUNT,BILPQW
i want assistance to recover the key of my user,recover_password,,,,,ACCOUNT,BLQ
want help retrieving my user key,recover_password,,,,,ACCOUNT,BLQ
how do i retrieve my account pass,recover_password,,,,,ACCOUNT,BILQ
have preoblems with my forgotten pin code,recover_password,,,,,ACCOUNT,BLMQZ
how can i retrieve my account acvess key,recover_password,,,,,ACCOUNT,BILQZ
I need help to retrieve the access key of my user,recover_password,,,,,ACCOUNT,BL
i dont know what to do to reset my user account pin code,recover_password,,,,,ACCOUNT,BLQ
i need help restoring my user profile pasword,recover_password,,,,,ACCOUNT,BLQZ
how can I get information about the lost PIN?,recover_password,,,,,ACCOUNT,BIL
i have problems with the pin code retrieval,recover_password,,,,,ACCOUNT,BLMQ
I need to retrieve the password of my profile,recover_password,,,,,ACCOUNT,BL
have a question about a lost padsword,recover_password,,,,,ACCOUNT,BLQZ
i forgot my pwd where to restore it,recover_password,,,,,ACCOUNT,BCILQ
I want assistance restoring my PIN code,recover_password,,,,,ACCOUNT,BL
where can I recover my damn profile password?,recover_password,,,,,ACCOUNT,BILW
I have a question about my PIN code reset,recover_password,,,,,ACCOUNT,BL
I am trying to retrieve my profile access key,recover_password,,,,,ACCOUNT,BL
I am trying to find information about a key reset,recover_password,,,,,ACCOUNT,BEL
i need assistanec resetting the pin of my profile,recover_password,,,,,ACCOUNT,BLQZ
how can i reset the pass of my account,recover_password,,,,,ACCOUNT,BILQ
i need help to reset the pin of my user account,recover_password,,,,,ACCOUNT,BLQ
can you help me to recover my user account PIN code?,recover_password,,,,,ACCOUNT,BIL
I want assistance to recover my profile access key,recover_password,,,,,ACCOUNT,BL
I want assistance to reset my user account PIN code,recover_password,,,,,ACCOUNT,BL
wanna recover my bloody pwd i need assistance,recover_password,,,,,ACCOUNT,BCLQW
information about forgotten pass,recover_password,,,,,ACCOUNT,BLQ
I need help to recover the PIN of my account,recover_password,,,,,ACCOUNT,BL
could you help me restoring my key?,recover_password,,,,,ACCOUNT,BILP
how to restore my access key,recover_password,,,,,ACCOUNT,BILQ
help to reset the access key of my account,recover_password,,,,,ACCOUNT,BL
help me resoring my profile pwd,recover_password,,,,,ACCOUNT,BLQZ
is it possible to restore my user PIN code?,recover_password,,,,,ACCOUNT,BIL
assistance recovering my user password,recover_password,,,,,ACCOUNT,BL
where do I restore the pass of my profile?,recover_password,,,,,ACCOUNT,BILQ
can you help me reset the key of my user profile?,recover_password,,,,,ACCOUNT,BIL
i cannot recover my fucking user access key,recover_password,,,,,ACCOUNT,BELNQW
assistance retrieving the pass of my user profile,recover_password,,,,,ACCOUNT,BLQ
I need help retrieving my user PIN code,recover_password,,,,,ACCOUNT,BL
I have got to rset my profile PIN,recover_password,,,,,ACCOUNT,BLZ
wanna reset my usef account pass,recover_password,,,,,ACCOUNT,BLQZ
can i restore my account pin code,recover_password,,,,,ACCOUNT,BILQ
"I lost my key, help me recovering it",recover_password,,,,,ACCOUNT,BCL
need assistance to recover the PIN of my profile,recover_password,,,,,ACCOUNT,BLQ
where can I get information about lost pwd?,recover_password,,,,,ACCOUNT,BILQ
I have problems with my password recovery,recover_password,,,,,ACCOUNT,BLM
help me to restore my user profile PIN,recover_password,,,,,ACCOUNT,BL
want assistance resetting my profile key,recover_password,,,,,ACCOUNT,BLQ
"I lost the fucking PIN of my account, help me recovering it",recover_password,,,,,ACCOUNT,BCLW
have a qustion about a lost pwd,recover_password,,,,,ACCOUNT,BLQZ
I do not know how I canrestore my user account pass,recover_password,,,,,ACCOUNT,BELQZ
problem with the forgotten PIN,recover_password,,,,,ACCOUNT,BL
can I reset the PIN code of my profile?,recover_password,,,,,ACCOUNT,BIL
I have got to restore my account key,recover_password,,,,,ACCOUNT,BL
I want help resetting my user account key,recover_password,,,,,ACCOUNT,BL
I don't know how I can reset the password of my user,recover_password,,,,,ACCOUNT,BL
"I lost my account password, can you help me to recover it?",recover_password,,,,,ACCOUNT,BCIL
I do not know how I could retrieve my user key,recover_password,,,,,ACCOUNT,BELP
I need to reset my user PIN,recover_password,,,,,ACCOUNT,BL
I try to reset the pwd of my user,recover_password,,,,,ACCOUNT,BLQ
I have got to report a signup issue,registration_problems,,,,,ACCOUNT,BL
what do i have to do to report a sign-up problem,registration_problems,,,,,ACCOUNT,BILQ
I want assistance to inform of fucking registration issues,registration_problems,,,,,ACCOUNT,BLMW
i cannot create an account i have to report a signup problem,registration_problems,,,,,ACCOUNT,BCELNQ
what do I have to do to report signup issues?,registration_problems,,,,,ACCOUNT,BILM
could you help me to notify of issues with signup?,registration_problems,,,,,ACCOUNT,BILMP
help me to report a signup issue,registration_problems,,,,,ACCOUNT,BL
I try to notify of a regstration error,registration_problems,,,,,ACCOUNT,BLZ
where can i report a registration error,registration_problems,,,,,ACCOUNT,BILQ
how do I inform of problems with signup?,registration_problems,,,,,ACCOUNT,BILM
what do I have to do to report a signup error?,registration_problems,,,,,ACCOUNT,BIL
reporting issue with registration,registration_problems,,,,,ACCOUNT,BK
I do not know how to inform of problems with a registration,registration_problems,,,,,ACCOUNT,BELM
I need help reeporting a signup issue,registration_problems,,,,,ACCOUNT,BLZ
want assistance to report problems with signup,registration_problems,,,,,ACCOUNT,BLMQ
where to notify of a registration problem?,registration_problems,,,,,ACCOUNT,BIL
I need help reporting a problem with signup,registration_problems,,,,,ACCOUNT,BL
"I cannot open a user, how could I report sign-up errors?",registration_problems,,,,,ACCOUNT,BCEILMNP
i do not know how to notify of an issue with a sign-up,registration_problems,,,,,ACCOUNT,BELQ
how could I report a sign-up issue?,registration_problems,,,,,ACCOUNT,BILP
I do not know how to notify of sign-up errors,registration_problems,,,,,ACCOUNT,BELM
i dont know how to report an issue with sign-up,registration_problems,,,,,ACCOUNT,BLQ
need assistance to inform of issues  with registrations,registration_problems,,,,,ACCOUNT,BLMQZ
I want to inform of a sign-up issue,registration_problems,,,,,ACCOUNT,BL
report a problem with registrations,registration_problems,,,,,ACCOUNT,BL
I want to inform of sign-up issues,registration_problems,,,,,ACCOUNT,BLM
help creating account,registration_problems,,,,,ACCOUNT,BK
I do not know how I can inform of an error with a sign-up,registration_problems,,,,,ACCOUNT,BEL
i have to notify of signup problems,registration_problems,,,,,ACCOUNT,BLMQ
can you help me report a sign-up error?,registration_problems,,,,,ACCOUNT,BIL
"I am experiencing errors registering, could you help me?",registration_problems,,,,,ACCOUNT,BCEILMP
how to notify of signup issues,registration_problems,,,,,ACCOUNT,BILMQ
I want assistance to inform of errors with signup,registration_problems,,,,,ACCOUNT,BLM
i need assistance to inform of issues with signup,registration_problems,,,,,ACCOUNT,BLMQ
want support regarding my online  registration,registration_problems,,,,,ACCOUNT,BLQZ
assistance informing of rgistration problems,registration_problems,,,,,ACCOUNT,BLMZ
I don't know how I can report problems with a registration,registration_problems,,,,,ACCOUNT,BLM
need assistance notifying of an issue with signup,registration_problems,,,,,ACCOUNT,BLQ
i need assistance notifying of a registration problem,registration_problems,,,,,ACCOUNT,BLQ
notifying of error creating accojnt,registration_problems,,,,,ACCOUNT,BKLZ
i dont know how to notify of registration errors,registration_problems,,,,,ACCOUNT,BLMQ
I have to inform of sign-up issues,registration_problems,,,,,ACCOUNT,BLM
reporting errors with sign-up,registration_problems,,,,,ACCOUNT,BKLM
can uhelp me ot report signup issues,registration_problems,,,,,ACCOUNT,BILMQZ
want help to report signup issues,registration_problems,,,,,ACCOUNT,BLMQ
i cant create a user can uhelp me to report sign-uup issues,registration_problems,,,,,ACCOUNT,BCILMNQZ
want assistance to inform of issues with a registration,registration_problems,,,,,ACCOUNT,BLMQ
issue creating user,registration_problems,,,,,ACCOUNT,BK
what do I need to do to notify of issues with signup?,registration_problems,,,,,ACCOUNT,BILM
I can't inform of a registration issue,registration_problems,,,,,ACCOUNT,BLN
