utterance,intent,entity_type,entity_value,start_offset,end_offset,category,tags
wanna see the payment options i need assistance,check_payment_methods,,,,,PAYMENT,BCLQ
is it possible to see what payment methods are available?,check_payment_methods,,,,,PAYMENT,BIL
how can i check ur allowed payment methods,check_payment_methods,,,,,PAYMENT,BIQ
want assistance listing the accepted payment options,check_payment_methods,,,,,PAYMENT,BLQ
I don't know how I can check your accepted payment methods,check_payment_methods,,,,,PAYMENT,BL
help listing your allowed payment options,check_payment_methods,,,,,PAYMENT,BL
need assistance seeing your allowed payment options,check_payment_methods,,,,,PAYMENT,BLQ
allowed payment methods,check_payment_methods,,,,,PAYMENT,BK
I do not know how to see the allowed payment modalities,check_payment_methods,,,,,PAYMENT,BEL
where can I list your accepted payment methods?,check_payment_methods,,,,,PAYMENT,BIL
how can I check the payment modalities?,check_payment_methods,,,,,PAYMENT,BIL
"I want to see the payment methods, help me",check_payment_methods,,,,,PAYMENT,BCL
i hyave to check the accepted payment modalities,check_payment_methods,,,,,PAYMENT,BLQZ
I need help listing the bloody payment options,check_payment_methods,,,,,PAYMENT,BLW
I want to lisg your allowed payment options,check_payment_methods,,,,,PAYMENT,BLZ
wanna list ur payment methods,check_payment_methods,,,,,PAYMENT,BLQ
want assistance checking ur payment modalities,check_payment_methods,,,,,PAYMENT,BLQ
I need assistance seeing your available payment modalities,check_payment_methods,,,,,PAYMENT,BL
what payment options uaccept,check_payment_methods,,,,,PAYMENT,BILQ
"I need to list your available  payment methods, help me",check_payment_methods,,,,,PAYMENT,BCLZ
need to see the payment methods,check_payment_methods,,,,,PAYMENT,BLQ
I do not know how to see your accepted payment modalities,check_payment_methods,,,,,PAYMENT,BEL
I need help to check your payment modalities,check_payment_methods,,,,,PAYMENT,BL
list your available payment options,check_payment_methods,,,,,PAYMENT,BL
check accepted payment methods,check_payment_methods,,,,,PAYMENT,BKL
need to check ur fucking available payment options,check_payment_methods,,,,,PAYMENT,BLQW
I have got to see the allowed payment options,check_payment_methods,,,,,PAYMENT,BL
help me to check your allowed payment options,check_payment_methods,,,,,PAYMENT,BL
how can I see what payment payment modalities are allowed?,check_payment_methods,,,,,PAYMENT,BIL
how do I list your bloody payment modalities?,check_payment_methods,,,,,PAYMENT,BILW
I try to see what payment methods you accept,check_payment_methods,,,,,PAYMENT,BL
i dont know how i could check ur allowed payment modalities,check_payment_methods,,,,,PAYMENT,BLPQ
I want to list your payment modalities,check_payment_methods,,,,,PAYMENT,BL
help me check the available payment options,check_payment_methods,,,,,PAYMENT,BL
I am trying to check the available payment methods,check_payment_methods,,,,,PAYMENT,BL
where to see what payment payment modalities you accept?,check_payment_methods,,,,,PAYMENT,BIL
help me see what payment options are accepted,check_payment_methods,,,,,PAYMENT,BL
iwant assistance to see ur available payment options,check_payment_methods,,,,,PAYMENT,BLQZ
help to list the accepted payment options,check_payment_methods,,,,,PAYMENT,BL
I don't know how to check the payment modalities,check_payment_methods,,,,,PAYMENT,BL
I'm trying to check the available payment methods,check_payment_methods,,,,,PAYMENT,BLQ
I don't know how to list the payment modalities,check_payment_methods,,,,,PAYMENT,BL
"I want to check what payment methods are available, help me",check_payment_methods,,,,,PAYMENT,BC
I am trying to see the available payment methods,check_payment_methods,,,,,PAYMENT,BL
need assistance listing the payment modalities,check_payment_methods,,,,,PAYMENT,BLQ
where to see the payment options?,check_payment_methods,,,,,PAYMENT,BIL
I have got to see the available payment methods,check_payment_methods,,,,,PAYMENT,BL
i have got to check what payment options ya accept,check_payment_methods,,,,,PAYMENT,BLQ
I don't know what to do to see the allowed payment options,check_payment_methods,,,,,PAYMENT,BL
"I have to check your accepted payment methods, help me",check_payment_methods,,,,,PAYMENT,BCL
what do I have to do to see the accepted payment options?,check_payment_methods,,,,,PAYMENT,BIL
where do i see what payment options are accepted,check_payment_methods,,,,,PAYMENT,BILQ
I want assistance to list the available payment modalities,check_payment_methods,,,,,PAYMENT,BL
I do not know what to do to see the allowed payment methods,check_payment_methods,,,,,PAYMENT,BEL
where to see the available payment methods?,check_payment_methods,,,,,PAYMENT,BIL
I want help to list the available payment methods,check_payment_methods,,,,,PAYMENT,BL
can you help me to see your payment methods ?,check_payment_methods,,,,,PAYMENT,BILZ
"I have to check your accepted payment methods, I need help",check_payment_methods,,,,,PAYMENT,BCL
how do i list ur avaqilable payment options,check_payment_methods,,,,,PAYMENT,BILQZ
want help to list the payment modalities,check_payment_methods,,,,,PAYMENT,BLQ
I try to  list the payment modalities,check_payment_methods,,,,,PAYMENT,BLZ
can you help me see trhe payment methods?,check_payment_methods,,,,,PAYMENT,BILZ
i need help checking the accepted payment modalities,check_payment_methods,,,,,PAYMENT,BLQ
i need help to list the payment options,check_payment_methods,,,,,PAYMENT,BLQ
wheredo i check the accepted payment modalities,check_payment_methods,,,,,PAYMENT,BILQZ
I do not know how to check your payment methods,check_payment_methods,,,,,PAYMENT,BEL
i have to list ur fucking payment options help me,check_payment_methods,,,,,PAYMENT,BCLQW
"I want to check what payment options you accept, help me",check_payment_methods,,,,,PAYMENT,BCL
I don't know what to do to see the payment options,check_payment_methods,,,,,PAYMENT,BL
i want assistance to see the payment optinos,check_payment_methods,,,,,PAYMENT,BLQZ
I need assistance to check your accepted payment options,check_payment_methods,,,,,PAYMENT,BL
I want help to check the available payment modalities,check_payment_methods,,,,,PAYMENT,BL
can you help me see your accepted payment methods?,check_payment_methods,,,,,PAYMENT,BIL
need assistance checking what payment options you accept,check_payment_methods,,,,,PAYMENT,BLQ
I need assistance checking your payment options,check_payment_methods,,,,,PAYMENT,BL
wanna list ur cacepted payment methods how can i do it,check_payment_methods,,,,,PAYMENT,BCILQZ
i need help to list ur acceted payment modalities,check_payment_methods,,,,,PAYMENT,BLQZ
help to see your bloody available payment options,check_payment_methods,,,,,PAYMENT,BLW
i need help listing the available payment modalities,check_payment_methods,,,,,PAYMENT,BLQ
want help listing ur allowed payment modalities,check_payment_methods,,,,,PAYMENT,BLQ
where can I check your accepted payment methods?,check_payment_methods,,,,,PAYMENT,BIL
can ya help me to list ur allowed payment modalities,check_payment_methods,,,,,PAYMENT,BILQ
uaccept  paypal,check_payment_methods,,,,,PAYMENT,BILQZ
I want to see the available payment methods,check_payment_methods,,,,,PAYMENT,BL
where can I ese the allowed payment modalities?,check_payment_methods,,,,,PAYMENT,BILZ
help to see ur acecpted payment modalities,check_payment_methods,,,,,PAYMENT,BLQZ
where can i check the payment options,check_payment_methods,,,,,PAYMENT,BILQ
i want assistance to list the available payment methods,check_payment_methods,,,,,PAYMENT,BLQ
I am trying to see the accepted payment modalities,check_payment_methods,,,,,PAYMENT,BL
assistance seeng in what situations can I request refunds,check_refund_policy,,,,,REFUND,BLZ
I want to check in what cases can I ask for a reimbursement,check_refund_policy,,,,,REFUND,BL
help to check your money back policy,check_refund_policy,,,,,REFUND,B
i need assistance seeing ur fucking money back guarantee,check_refund_policy,,,,,REFUND,BLQW
help me seeing in what situations can I ask for refunds,check_refund_policy,,,,,REFUND,BL
I want help seeing in what cases can I ask to be reimbursed,check_refund_policy,,,,,REFUND,BL
I have to check in which situations can I ask for refunds,check_refund_policy,,,,,REFUND,BL
can I check in what situations can I ask to be reimbursed?,check_refund_policy,,,,,REFUND,BIL
i have to check in which cases can i request my money back,check_refund_policy,,,,,REFUND,BLQ
I am trying to check in which cases can I ask for a refund,check_refund_policy,,,,,REFUND,BL
"I need to check your reimbursement policy, will you help me?",check_refund_policy,,,,,REFUND,BCILP
help me checking in what cases can i request a refund,check_refund_policy,,,,,REFUND,BLQ
help to see in which cases can I ask for a reimbursement,check_refund_policy,,,,,REFUND,BL
can you show  me how long refunds usually take?,check_refund_policy,,,,,REFUND,BIZ
"I have to check your reimbursement policy, I need assistance",check_refund_policy,,,,,REFUND,BCL
how can I see your reimbursement policy?,check_refund_policy,,,,,REFUND,BIL
i have got to check in which cases can i ask for a refund,check_refund_policy,,,,,REFUND,BLQ
in which cases can i request a reimbursement,check_refund_policy,,,,,REFUND,BILQ
assistance seeing how long reimbursements usually take,check_refund_policy,,,,,REFUND,BL
I try to check your money back guarantee,check_refund_policy,,,,,REFUND,BL
I need help seeing in what cases can I ask to be reimbursed,check_refund_policy,,,,,REFUND,BL
see in which cases can I ask to be reimbursed,check_refund_policy,,,,,REFUND,BL
need assistance seeing how long refunds usually take,check_refund_policy,,,,,REFUND,BLQ
want help to see how long reimbursements atke,check_refund_policy,,,,,REFUND,BLQZ
I want help to see in what situations can I request a refund,check_refund_policy,,,,,REFUND,BL
i need help seeing ut money back guarantee,check_refund_policy,,,,,REFUND,BLQZ
wanna  see in what situations can i ask for refunds,check_refund_policy,,,,,REFUND,BLQZ
assistance to see in which situations can i ask for refunds,check_refund_policy,,,,,REFUND,BLQ
i have to ccheck in which cases can i request refunds,check_refund_policy,,,,,REFUND,BLQZ
can I check under what circumstances can I ask for refunds?,check_refund_policy,,,,,REFUND,BI
help me to check ur reimbursement oplicy,check_refund_policy,,,,,REFUND,BLQZ
i have got to see ur money back garantee can ya help me,check_refund_policy,,,,,REFUND,BCILQZ
help seeing in what situations can i request to be refunded,check_refund_policy,,,,,REFUND,BLQ
assistance seeing in what cases can I request my money back,check_refund_policy,,,,,REFUND,BL
i have to see in which cases can i ask for refunds help me,check_refund_policy,,,,,REFUND,BCLQ
i have to check in what cases can i request a erfund,check_refund_policy,,,,,REFUND,BLQZ
I need help to see in what cases can I ask for refunds,check_refund_policy,,,,,REFUND,BL
help to see under what circumstances can I request refunds,check_refund_policy,,,,,REFUND,BL
I want help checking how long reimbursements take,check_refund_policy,,,,,REFUND,BL
"I have to check your money back policy, help me",check_refund_policy,,,,,REFUND,BC
help seeing in what cases can i ask for a refund,check_refund_policy,,,,,REFUND,BLQ
help me see in what situations can I ask for refunds,check_refund_policy,,,,,REFUND,BL
I need to see in which situations can I request my money bak,check_refund_policy,,,,,REFUND,BLZ
help me see in which cases can i request to be refunded,check_refund_policy,,,,,REFUND,BLQ
want assistance seeing ur money back guarantee,check_refund_policy,,,,,REFUND,BLQ
need to see in what situations can i ask for reimbhursements,check_refund_policy,,,,,REFUND,BLQZ
I need to see how long the bloody refunds usually take,check_refund_policy,,,,,REFUND,BLW
show me under what circumstances can i request refunds,check_refund_policy,,,,,REFUND,BLQ
I need help seeing how long reimbursements take,check_refund_policy,,,,,REFUND,BL
in what situations can i ask to be reimbursed,check_refund_policy,,,,,REFUND,BILQ
I do not know how to check your reimbursement policy,check_refund_policy,,,,,REFUND,BEL
I can't see your reimbursement policy,check_refund_policy,,,,,REFUND,BL
i have got to check ur money back policy,check_refund_policy,,,,,REFUND,BQ
see your refund policy,check_refund_policy,,,,,REFUND,BKL
need assistance seeing ur money back policy,check_refund_policy,,,,,REFUND,BLQ
assistance to check in which cases can i request a refund,check_refund_policy,,,,,REFUND,BLQ
help me check in what cases can I request my money back,check_refund_policy,,,,,REFUND,BL
I need to see in which cases can I ask to be reimbursed,check_refund_policy,,,,,REFUND,BL
help me see in what caess can i request reimbursements,check_refund_policy,,,,,REFUND,BLQZ
help checking in which situations can I ask for a refund,check_refund_policy,,,,,REFUND,BL
help checking how long reimbursements usually take,check_refund_policy,,,,,REFUND,BL
"I want to see your money back policy, could you help me?",check_refund_policy,,,,,REFUND,BCILP
I try to see in whikch cases can I ask for a refund,check_refund_policy,,,,,REFUND,BLZ
help me see in what situations can i request refunds,check_refund_policy,,,,,REFUND,BLQ
check your money back policy,check_refund_policy,,,,,REFUND,BK
can I se under which circumstances can I request refunds?,check_refund_policy,,,,,REFUND,BILZ
want help seeing in whatsituations can I ask for refunds,check_refund_policy,,,,,REFUND,BLQZ
I need assistance checking your money back policy,check_refund_policy,,,,,REFUND,B
can you show me in which cases can I request my money back?,check_refund_policy,,,,,REFUND,BIL
I need help seeing how long refunds usually take,check_refund_policy,,,,,REFUND,BL
I need help checking how long reimbursements take,check_refund_policy,,,,,REFUND,BL
I'm trying to see in what casxes can i ask for refunds,check_refund_policy,,,,,REFUND,BLQZ
see in what situations can i request the goddamn refunds,check_refund_policy,,,,,REFUND,BLQW
help me to see in which cases can I request a refund,check_refund_policy,,,,,REFUND,BL
wanna see ur money back guarantee can i get some help,check_refund_policy,,,,,REFUND,BCILQ
can you help me see in what cases can I request refunds?,check_refund_policy,,,,,REFUND,BIL
help to see in hwat situations can i ask to be reimbursed,check_refund_policy,,,,,REFUND,BLQZ
see under which circumstances can I ask for a refund,check_refund_policy,,,,,REFUND,BL
in what situations can I ask for a refund?,check_refund_policy,,,,,REFUND,BIL
help me checking in what cases can I request a refund,check_refund_policy,,,,,REFUND,BL
"I have to see your money back guarantee , how to do it?",check_refund_policy,,,,,REFUND,BCILZ
help me see in which cases can I ask to be reimbursed,check_refund_policy,,,,,REFUND,BL
need help to check ur reimbursementpolicy,check_refund_policy,,,,,REFUND,BLQZ
under what circumstances can I ask for a damn reimbursement?,check_refund_policy,,,,,REFUND,BILW
under what circumstances can I request reimbursements ?,check_refund_policy,,,,,REFUND,BILZ
i have to see in what cases can i request to be refunded,check_refund_policy,,,,,REFUND,BLQ
could I see your money back policy?,check_refund_policy,,,,,REFUND,BILP
are charges of services reimbursable?,check_refund_policy,,,,,REFUND,BIL
help to see in what situations can i request a reimbursement,check_refund_policy,,,,,REFUND,BLQ
I need help to check in what cases can I ask for a refund,check_refund_policy,,,,,REFUND,B
where can i check ur money  back policy,check_refund_policy,,,,,REFUND,BIQZ
will you show me in which situations can I ask for refunds?,check_refund_policy,,,,,REFUND,BILP
can ya help me checking ur reimbursement policy,check_refund_policy,,,,,REFUND,BILQ
help me to see in what situations can I ask for refunds,check_refund_policy,,,,,REFUND,BL
would it be possible to chcek ur bloody money back guarantee,check_refund_policy,,,,,REFUND,BILPQWZ
help me check in what situations can I ask to be refunded,check_refund_policy,,,,,REFUND,BL
want help seeing in which situations can i ask for refunds,check_refund_policy,,,,,REFUND,BLQ
i have got to check in what cases can i ask to be reimbursed,check_refund_policy,,,,,REFUND,BLQ
see in which situations can I request a refund,check_refund_policy,,,,,REFUND,BL
how can I check your money back guarantee?,check_refund_policy,,,,,REFUND,BIL
I have to check in what cases can I request a reimbursement,check_refund_policy,,,,,REFUND,BL
help me to see in what cases can I request a damn refund,check_refund_policy,,,,,REFUND,BLW
can i check in what situations can i ask to be reimbursed,check_refund_policy,,,,,REFUND,BILQ
are the  charges of services refundable?,check_refund_policy,,,,,REFUND,BIZ
I need to check in what cases can I request my money back,check_refund_policy,,,,,REFUND,BL
ur money back policy,check_refund_policy,,,,,REFUND,BQ
want assistance checking your money back guarantee,check_refund_policy,,,,,REFUND,BLQ
want help to see in what cases can I ask for reimbursements,check_refund_policy,,,,,REFUND,BLQ
can you help me seeing your reimbursement policy?,check_refund_policy,,,,,REFUND,BIL
I don't know what to do to check your money back guarantee,check_refund_policy,,,,,REFUND,BL
I need to check in which acses can I ask for refunds,check_refund_policy,,,,,REFUND,BLZ
assistance seeing in what cases can I ask for a refund,check_refund_policy,,,,,REFUND,BL
help checking in what cases can i ask to be refunded,check_refund_policy,,,,,REFUND,BQ
I am trying to see in what situations can I ask for a refund,check_refund_policy,,,,,REFUND,BL
want help to see in what cases can I ask for refunds,check_refund_policy,,,,,REFUND,BLQ
help me check in which situations can I ask to be reimbursed,check_refund_policy,,,,,REFUND,BL
what do i have to do to check ur refund policy,check_refund_policy,,,,,REFUND,BIQ
help me to see in what cases can I ask for refunds,check_refund_policy,,,,,REFUND,BL
I want help to check in what cases can I ask for a refund,check_refund_policy,,,,,REFUND,B
help to check in what cases can I request to be reimnursed,check_refund_policy,,,,,REFUND,BLZ
assistance to check in what situations can I request refunds,check_refund_policy,,,,,REFUND,BL
show me under what circumstances can I request a refund,check_refund_policy,,,,,REFUND,BL
in what cases can I request my money back?,check_refund_policy,,,,,REFUND,BIL
i need assistance checking ur reimbursement policy,check_refund_policy,,,,,REFUND,BLQ
I would like to see your refund policy,check_refund_policy,,,,,REFUND,BLP
show me in what situations can I ask for my money bacxk,check_refund_policy,,,,,REFUND,BLZ
assistance to see in which cases can i ask for my money back,check_refund_policy,,,,,REFUND,BLQ
help me to see in what cases can i request a refund,check_refund_policy,,,,,REFUND,BLQ
I want help to see in what cases can I ask for a refund,check_refund_policy,,,,,REFUND,BL
I need to check in which cases can I ask for my money back,check_refund_policy,,,,,REFUND,BL
see in what situations can I request my money back,check_refund_policy,,,,,REFUND,BL
needto see ur refund policy could uhelp me,check_refund_policy,,,,,REFUND,BCILPQZ
help checking how long refunds usually take,check_refund_policy,,,,,REFUND,B
could I see in what situations can I ask for my money back?,check_refund_policy,,,,,REFUND,BILP
want assistance seeing your refund policy,check_refund_policy,,,,,REFUND,BLQ
I need assistance seeing your reimbursement policy,check_refund_policy,,,,,REFUND,BL
I want to see in what situations can I ask to be refunded,check_refund_policy,,,,,REFUND,BL
in which cases can i ask for my money back,check_refund_policy,,,,,REFUND,BILQ
I try to check in which cases can I request a reimbursement,check_refund_policy,,,,,REFUND,BL
I try to see in which cases can I ask for refunds,check_refund_policy,,,,,REFUND,BL
I try to see in which cases can I request my money back,check_refund_policy,,,,,REFUND,BL
i dont know what i need to do to see ur refund policy,check_refund_policy,,,,,REFUND,BLQ
i have to see how long reimbursements take,check_refund_policy,,,,,REFUND,BLQ
"I need to check your money back guarantee, how can I do it?",check_refund_policy,,,,,REFUND,BCIL
I have to check in which situations can I ask to be refunded,check_refund_policy,,,,,REFUND,BL
under which circumstances can I request my money back?,check_refund_policy,,,,,REFUND,BIL
help me to check in what cases can i ask for refunds,check_refund_policy,,,,,REFUND,BQ
is it possible to see ur money back guafantee,check_refund_policy,,,,,REFUND,BILQZ
I need to check in what cases can I ask for refunds,check_refund_policy,,,,,REFUND,B
I want help to see in which situations can I ask for refunds,check_refund_policy,,,,,REFUND,BL
could uhelp me checking in what cases can i ask for reufnds,check_refund_policy,,,,,REFUND,BIPQZ
I want help seeing how long refunds usually take,check_refund_policy,,,,,REFUND,BL
check in what cases can I request a refund,check_refund_policy,,,,,REFUND,BL
assistance checking inn which cases can i ask for a refund,check_refund_policy,,,,,REFUND,BLQZ
I want asistance checking how long refunds take,check_refund_policy,,,,,REFUND,BZ
i try to check in what cases can i ask for reimbursements,check_refund_policy,,,,,REFUND,BLQ
"I want to see how long reimbursements take , how to do it?",check_refund_policy,,,,,REFUND,BCILZ
help seeing in what situations can I ask to be refunded,check_refund_policy,,,,,REFUND,BL
i dont know what to do to see ur money back guarantee,check_refund_policy,,,,,REFUND,BLQ
I need to see in what cases can I request reimbursements,check_refund_policy,,,,,REFUND,BL
I want to see your money back policy,check_refund_policy,,,,,REFUND,BL
wanna see in what situations can i request  my money back,check_refund_policy,,,,,REFUND,BLQZ
can i see in which situations can i ask for a refund,check_refund_policy,,,,,REFUND,BILQ
"I have to see your money back policy, help me",check_refund_policy,,,,,REFUND,BCL
show me in which situations can I ask for a reimbursement,check_refund_policy,,,,,REFUND,BL
help me check in which cases can I request to be refunded,check_refund_policy,,,,,REFUND,BL
I want help seeing how long reimbursements take,check_refund_policy,,,,,REFUND,BL
wanna check ur refun policy can uhelp me,check_refund_policy,,,,,REFUND,BCIQZ
i have to see in what situations can i requet my money back,check_refund_policy,,,,,REFUND,BLQZ
I don't know how I could check your reimbursement policy,check_refund_policy,,,,,REFUND,BLP
can i check in what cases can i ask for reimbursements,check_refund_policy,,,,,REFUND,BILQ
need help to check in what cases can I request refunds,check_refund_policy,,,,,REFUND,BLQ
I need help seeing in what situations can I request a refund,check_refund_policy,,,,,REFUND,BL
help me checking in which situations can i request a refund,check_refund_policy,,,,,REFUND,BLQ
I need help to check your damn reimbursement policy,check_refund_policy,,,,,REFUND,BLW
help to see in what cases can i request to be reimbursed,check_refund_policy,,,,,REFUND,BLQ
I need help checking hiw long refunds usually take,check_refund_policy,,,,,REFUND,BZ
help checking ur money back policy,check_refund_policy,,,,,REFUND,BQ
help to see in what cases can I request my money back,check_refund_policy,,,,,REFUND,BL
help checking in which cases can i ask to be refunded,check_refund_policy,,,,,REFUND,BLQ
can I see in what situations can I request redimbursements?,check_refund_policy,,,,,REFUND,BILZ
I have to check in what cases can I ask to be refunded,check_refund_policy,,,,,REFUND,B
wanna check ur reimbursement policy can i get some help,check_refund_policy,,,,,REFUND,BCILQ
can you show me in what cases can I request reimbursements?,check_refund_policy,,,,,REFUND,BIL
help me check in what cases can I ask to be reimbursed,check_refund_policy,,,,,REFUND,BL
assistance to see ur money back guarantee,check_refund_policy,,,,,REFUND,BLQ
will you show me in what situations can I ask for refunds?,check_refund_policy,,,,,REFUND,BILP
can you show me in which cases can I ask to be reimbursed?,check_refund_policy,,,,,REFUND,BIL
help me see in which cases can I request my money back,check_refund_policy,,,,,REFUND,BL
help to see in which cases can I ask for a refund,check_refund_policy,,,,,REFUND,BL
can I check in what cases can I request to be refunded?,check_refund_policy,,,,,REFUND,BIL
wanna see how long refunds take how can i do it,check_refund_policy,,,,,REFUND,BCILQ
help seeing in which cases can i request a refund,check_refund_policy,,,,,REFUND,BLQ
help seeing in what situations can I request my money back,check_refund_policy,,,,,REFUND,BL
"I have got to see your refund policy, help me",check_refund_policy,,,,,REFUND,BCL
"I want to check your money back guarantee, how to do it?",check_refund_policy,,,,,REFUND,BCIL
I want help to see how long the goddamn refunds take,check_refund_policy,,,,,REFUND,BLW
where do i see ur bloody refund policy,check_refund_policy,,,,,REFUND,BILQW
wanna check in what cases can i ask to be refunded help me,check_refund_policy,,,,,REFUND,BCQ
help me to see in what cases can I request my money back,check_refund_policy,,,,,REFUND,BL
I want help to see in which cases can I ask for refunds,check_refund_policy,,,,,REFUND,BL
can ya help me checking how long reimburaements take,check_refund_policy,,,,,REFUND,BILQZ
i have to see ur money back guarantee  how can i do it,check_refund_policy,,,,,REFUND,BCILQZ
I cannot check your money back guarantee,check_refund_policy,,,,,REFUND,BEL
"I have got to see how long reimbursements take, help me",check_refund_policy,,,,,REFUND,BCL
i have to check in which cases can i ask to be refunded,check_refund_policy,,,,,REFUND,BLQ
help checking in what cases can I request to be reimbursed,check_refund_policy,,,,,REFUND,BL
